{
  "$schema": "http://json-schema.org/draft-07/schema#",
  "title": "Resume",
  "type": "object",
  "properties": {
    "summary": {
      "type": "string"
    },
    "experience": {
      "type": "array",
      "items": {
        "type": "object",
        "properties": {
          "company": {
            "type": "string"
          },
          "role": {
            "type": "string"
          },
          "location": {
            "type": "string"
          },
          "start": {
            "type": "string"
          },
          "end": {
            "type": "string"
          },
          "bullets": {
            "type": "array",
            "items": {
              "type": "string"
            }
          }
        },
        "required": [
          "company",
          "role"
        ]
      }
    },
    "skills": {
      "type": "array",
      "items": {
        "type": "string"
      }
    },
    "education": {
      "type": "array",
      "items": {
        "type": "object",
        "properties": {
          "title": {
            "type": "string"
          },
          "bullets": {
            "type": "array",
            "items": {
              "type": "string"
            }
          }
        },
        "required": [
          "title"
        ]
      }
    },
    "hobbies": {
      "type": "array",
      "items": {
        "type": "string"
      }
    },
    "sections": {
      "type": "array",
      "items": {
        "type": "object",
        "properties": {
          "id": {
            "type": "string"
          },
          "title": {
            "type": "string"
          },
          "type": {
            "type": "string",
            "enum": [
              "pills",
              "bullets",
              "paragraph",
              "html"
            ]
          },
          "items": {
            "type": "array",
            "items": {
              "type": "string"
            }
          },
          "text": {
            "type": "string"
          },
          "html": {
            "type": "string"
          }
        },
        "required": [
          "title",
          "type"
        ]
      }
    },
    "contact": {
      "type": "object",
      "properties": {
        "phone": {
          "type": "string"
        },
        "email": {
          "type": "string"
        },
        "linkedin": {
          "type": "string"
        },
        "resumeFile": {
          "type": "string"
        }
      }
    }
  },
  "required": [
    "summary"
  ]
}